[
  {
    "id": 1,
    "nameCN": "鬼谋",
    "universe": 2,
    "stageNumber": 26,
    "enemies": [],
    "boss": 0,
    "itemDrops": [
      386,
      387
    ],
    "weaponType": 0,
    "itemSet": 0,
    "itemLevel": 1,
    "difficulty": 0,
    "unlockCondition": 0,
    "stageType": 0,
    "nameEN": "Plot"
  },
  {
    "id": 2,
    "nameCN": "闭月",
    "universe": 2,
    "stageNumber": 60,
    "enemies": [],
    "boss": 0,
    "itemDrops": [
      388,
      389
    ],
    "weaponType": 0,
    "itemSet": 0,
    "itemLevel": 1,
    "difficulty": 0,
    "unlockCondition": 0,
    "stageType": 0,
    "nameEN": "Moon"
  },
  {
    "id": 3,
    "nameCN": "辕门",
    "universe": 2,
    "stageNumber": 13,
    "enemies": [],
    "boss": 0,
    "itemDrops": [
      390,
      391
    ],
    "weaponType": 0,
    "itemSet": 0,
    "itemLevel": 1,
    "difficulty": 0,
    "unlockCondition": 0,
    "stageType": 0,
    "nameEN": "Gate"
  },
  {
    "id": 4,
    "nameCN": "洛神",
    "universe": 2,
    "stageNumber": 61,
    "enemies": [],
    "boss": 0,
    "itemDrops": [
      392,
      393
    ],
    "weaponType": 0,
    "itemSet": 0,
    "itemLevel": 1,
    "difficulty": 0,
    "unlockCondition": 0,
    "stageType": 0,
    "nameEN": "Goddess"
  },
  {
    "id": 5,
    "nameCN": "铜雀",
    "universe": 2,
    "stageNumber": 50,
    "enemies": [],
    "boss": 0,
    "itemDrops": [
      394,
      395
    ],
    "weaponType": 0,
    "itemSet": 0,
    "itemLevel": 1,
    "difficulty": 0,
    "unlockCondition": 0,
    "stageType": 0,
    "nameEN": "Sparrow"
  },
  {
    "id": 6,
    "nameCN": "悬壶",
    "universe": 2,
    "stageNumber": 16,
    "enemies": [],
    "boss": 0,
    "itemDrops": [
      396,
      397
    ],
    "weaponType": 0,
    "itemSet": 0,
    "itemLevel": 1,
    "difficulty": 0,
    "unlockCondition": 0,
    "stageType": 0,
    "nameEN": "Heal"
  },
  {
    "id": 7,
    "nameCN": "忠义",
    "universe": 2,
    "stageNumber": 40,
    "enemies": [],
    "boss": 0,
    "itemDrops": [
      398,
      399
    ],
    "weaponType": 0,
    "itemSet": 0,
    "itemLevel": 1,
    "difficulty": 0,
    "unlockCondition": 0,
    "stageType": 0,
    "nameEN": "Loyalty"
  },
  {
    "id": 8,
    "nameCN": "先登",
    "universe": 2,
    "stageNumber": 64,
    "enemies": [],
    "boss": 0,
    "itemDrops": [
      400,
      401
    ],
    "weaponType": 0,
    "itemSet": 0,
    "itemLevel": 1,
    "difficulty": 0,
    "unlockCondition": 0,
    "stageType": 0,
    "nameEN": "Ascent"
  },
  {
    "id": 9,
    "nameCN": "陷阵",
    "universe": 2,
    "stageNumber": 20,
    "enemies": [],
    "boss": 0,
    "itemDrops": [
      402,
      403
    ],
    "weaponType": 0,
    "itemSet": 0,
    "itemLevel": 1,
    "difficulty": 0,
    "unlockCondition": 0,
    "stageType": 0,
    "nameEN": "Charge"
  },
  {
    "id": 10,
    "nameCN": "奇门",
    "universe": 2,
    "stageNumber": 54,
    "enemies": [],
    "boss": 0,
    "itemDrops": [
      404,
      405
    ],
    "weaponType": 0,
    "itemSet": 0,
    "itemLevel": 1,
    "difficulty": 0,
    "unlockCondition": 0,
    "stageType": 0,
    "nameEN": "Mystery"
  },
  {
    "id": 11,
    "nameCN": "苍天",
    "universe": 4,
    "stageNumber": 12,
    "enemies": [
      153
    ],
    "boss": 0,
    "itemDrops": [
      406,
      407,
      408,
      409
    ],
    "weaponType": 0,
    "itemSet": 0,
    "itemLevel": 1,
    "difficulty": 0,
    "unlockCondition": 1,
    "stageType": 1,
    "nameEN": "Heaven"
  },
  {
    "id": 12,
    "nameCN": "虎豹",
    "universe": 4,
    "stageNumber": 21,
    "enemies": [
      154
    ],
    "boss": 0,
    "itemDrops": [
      410,
      411,
      412,
      413
    ],
    "weaponType": 0,
    "itemSet": 0,
    "itemLevel": 1,
    "difficulty": 0,
    "unlockCondition": 1,
    "stageType": 2,
    "nameEN": "Beasts"
  },
  {
    "id": 13,
    "nameCN": "武侯",
    "universe": 4,
    "stageNumber": 65,
    "enemies": [
      155
    ],
    "boss": 0,
    "itemDrops": [
      414,
      415,
      416,
      417
    ],
    "weaponType": 0,
    "itemSet": 0,
    "itemLevel": 1,
    "difficulty": 0,
    "unlockCondition": 1,
    "stageType": 3,
    "nameEN": "marquis"
  },
  {
    "id": 14,
    "nameCN": "江东",
    "universe": 4,
    "stageNumber": 46,
    "enemies": [
      156
    ],
    "boss": 0,
    "itemDrops": [
      418,
      419,
      420,
      421
    ],
    "weaponType": 0,
    "itemSet": 0,
    "itemLevel": 1,
    "difficulty": 0,
    "unlockCondition": 1,
    "stageType": 4,
    "nameEN": "River"
  },
  {
    "id": 15,
    "nameCN": "黄天",
    "universe": 6,
    "stageNumber": 60,
    "enemies": [
      12,
      153
    ],
    "boss": 0,
    "itemDrops": [
      422,
      423,
      424,
      425,
      426,
      427
    ],
    "weaponType": 0,
    "itemSet": 0,
    "itemLevel": 1,
    "difficulty": 0,
    "unlockCondition": 1,
    "stageType": 1,
    "nameEN": "Sky"
  },
  {
    "id": 16,
    "nameCN": "魏武",
    "universe": 6,
    "stageNumber": 50,
    "enemies": [
      21,
      154
    ],
    "boss": 0,
    "itemDrops": [
      428,
      429,
      430,
      431,
      432,
      433
    ],
    "weaponType": 0,
    "itemSet": 0,
    "itemLevel": 1,
    "difficulty": 0,
    "unlockCondition": 1,
    "stageType": 2,
    "nameEN": "Lord"
  },
  {
    "id": 17,
    "nameCN": "八阵",
    "universe": 6,
    "stageNumber": 54,
    "enemies": [
      65,
      155
    ],
    "boss": 0,
    "itemDrops": [
      434,
      435,
      436,
      437,
      438,
      439
    ],
    "weaponType": 0,
    "itemSet": 0,
    "itemLevel": 1,
    "difficulty": 0,
    "unlockCondition": 1,
    "stageType": 3,
    "nameEN": "Array"
  },
  {
    "id": 18,
    "nameCN": "猛虎",
    "universe": 6,
    "stageNumber": 20,
    "enemies": [
      46,
      156
    ],
    "boss": 0,
    "itemDrops": [
      440,
      441,
      442,
      443,
      444,
      445
    ],
    "weaponType": 0,
    "itemSet": 0,
    "itemLevel": 1,
    "difficulty": 0,
    "unlockCondition": 1,
    "stageType": 4,
    "nameEN": "Tiger"
  },
  {
    "id": 19,
    "nameCN": "七星",
    "universe": 2,
    "stageNumber": 26,
    "enemies": [],
    "boss": 0,
    "itemDrops": [
      446,
      447
    ],
    "weaponType": 0,
    "itemSet": 0,
    "itemLevel": 1,
    "difficulty": 0,
    "unlockCondition": 0,
    "stageType": 0,
    "nameEN": "Stars"
  },
  {
    "id": 20,
    "nameCN": "无双",
    "universe": 2,
    "stageNumber": 13,
    "enemies": [],
    "boss": 0,
    "itemDrops": [
      448,
      449
    ],
    "weaponType": 0,
    "itemSet": 0,
    "itemLevel": 1,
    "difficulty": 0,
    "unlockCondition": 0,
    "stageType": 0,
    "nameEN": "Unique"
  },
  {
    "id": 21,
    "nameCN": "恶来",
    "universe": 2,
    "stageNumber": 61,
    "enemies": [],
    "boss": 0,
    "itemDrops": [
      450,
      451
    ],
    "weaponType": 0,
    "itemSet": 0,
    "itemLevel": 1,
    "difficulty": 0,
    "unlockCondition": 0,
    "stageType": 0,
    "nameEN": "Evil"
  },
  {
    "id": 22,
    "nameCN": "王佐",
    "universe": 2,
    "stageNumber": 16,
    "enemies": [],
    "boss": 0,
    "itemDrops": [
      452,
      453
    ],
    "weaponType": 0,
    "itemSet": 0,
    "itemLevel": 1,
    "difficulty": 0,
    "unlockCondition": 0,
    "stageType": 0,
    "nameEN": "Aid"
  },
  {
    "id": 23,
    "nameCN": "桃园",
    "universe": 2,
    "stageNumber": 40,
    "enemies": [],
    "boss": 0,
    "itemDrops": [
      454,
      455
    ],
    "weaponType": 0,
    "itemSet": 0,
    "itemLevel": 1,
    "difficulty": 0,
    "unlockCondition": 0,
    "stageType": 0,
    "nameEN": "Orchard"
  },
  {
    "id": 24,
    "nameCN": "龙胆",
    "universe": 2,
    "stageNumber": 64,
    "enemies": [],
    "boss": 0,
    "itemDrops": [
      456,
      457
    ],
    "weaponType": 0,
    "itemSet": 0,
    "itemLevel": 1,
    "difficulty": 0,
    "unlockCondition": 0,
    "stageType": 0,
    "nameEN": "Gall"
  },
  {
    "id": 25,
    "nameCN": "浮华",
    "universe": 2,
    "stageNumber": 65,
    "enemies": [],
    "boss": 0,
    "itemDrops": [
      458,
      459
    ],
    "weaponType": 0,
    "itemSet": 0,
    "itemLevel": 2,
    "difficulty": 0,
    "unlockCondition": 0,
    "stageType": 0,
    "nameEN": "Gorgeous"
  },
  {
    "id": 26,
    "nameCN": "桃花",
    "universe": 2,
    "stageNumber": 48,
    "enemies": [],
    "boss": 0,
    "itemDrops": [
      460,
      461
    ],
    "weaponType": 0,
    "itemSet": 0,
    "itemLevel": 2,
    "difficulty": 0,
    "unlockCondition": 0,
    "stageType": 0,
    "nameEN": "Blossom"
  },
  {
    "id": 27,
    "nameCN": "金刚",
    "universe": 2,
    "stageNumber": 27,
    "enemies": [],
    "boss": 0,
    "itemDrops": [
      462,
      463
    ],
    "weaponType": 0,
    "itemSet": 0,
    "itemLevel": 2,
    "difficulty": 0,
    "unlockCondition": 0,
    "stageType": 0,
    "nameEN": "Vajra"
  },
  {
    "id": 28,
    "nameCN": "巫山",
    "universe": 2,
    "stageNumber": 52,
    "enemies": [],
    "boss": 0,
    "itemDrops": [
      464,
      465
    ],
    "weaponType": 0,
    "itemSet": 0,
    "itemLevel": 2,
    "difficulty": 0,
    "unlockCondition": 0,
    "stageType": 0,
    "nameEN": "Mountain"
  },
  {
    "id": 29,
    "nameCN": "古墓",
    "universe": 2,
    "stageNumber": 39,
    "enemies": [],
    "boss": 0,
    "itemDrops": [
      466,
      467
    ],
    "weaponType": 0,
    "itemSet": 0,
    "itemLevel": 2,
    "difficulty": 0,
    "unlockCondition": 0,
    "stageType": 0,
    "nameEN": "Tomb"
  },
  {
    "id": 30,
    "nameCN": "剑势",
    "universe": 2,
    "stageNumber": 93,
    "enemies": [],
    "boss": 0,
    "itemDrops": [
      468,
      469
    ],
    "weaponType": 0,
    "itemSet": 0,
    "itemLevel": 2,
    "difficulty": 0,
    "unlockCondition": 0,
    "stageType": 0,
    "nameEN": "Sword Pwr"
  },
  {
    "id": 31,
    "nameCN": "武林",
    "universe": 2,
    "stageNumber": 62,
    "enemies": [],
    "boss": 0,
    "itemDrops": [
      470,